{
  "schema_version": "momentumEpisode-v1",
  "contract_version": "1.2.0",
  "match_id": "golden-development-TEST",
  "halves_played": 1,
  "team_keys": [
    "team_a",
    "team_b"
  ],
  "producer": "analytics_only",
  "browser_inference_allowed": false,
  "coverage": {
    "status": "partial",
    "reason_code": "partial_evidence"
  },
  "episodes": [
    {
      "episode_id": "episode_6dc1c82a613ac36e",
      "half": 1,
      "start_time": 0.0,
      "end_time": 15.0,
      "team_key": "team_a",
      "direction": "positive",
      "start_momentum": 0.0,
      "end_momentum": 8.5,
      "swing": 8.5,
      "reason_codes": [
        "territory_pressure",
        "three_kill_chain"
      ],
      "contribution": {
        "kind": "momentum_swing",
        "value": 8.5,
        "unit": "momentum_index"
      },
      "confidence": {
        "level": "medium",
        "reason_code": "partial_evidence"
      },
      "coverage": {
        "status": "partial",
        "reason_code": "partial_evidence"
      },
      "clip_ref": "clip_a1b2c3d4e5f60718293a4b5c6d7e8f90"
    }
  ]
}
